{
  "node_tier": "T1 — Identity (Thực thể bền phi thời gian)",
  "standard_id": "GRI Glossary",
  "title_en": "GRI Standards Glossary 2025",
  "title_vi": "Thuật ngữ và Định nghĩa GRI 2025",
  "pillar": "Universal",
  "series": "Glossary",
  "category": "Reference",
  "temporal_validity": {
    "version_id": "GRI_Glossary_2025",
    "version_year": 2025,
    "effective_date": "2026-01-01",
    "valid_until_year": null,
    "status": "Active",
    "replaced_by_standard_id": null
  },
  "scope": {
    "target_audience": "Tất cả tổ chức",
    "sector_code": null,
    "materiality_required": false,
    "boundary_scope": "Toàn bộ tổ chức & Chuỗi giá trị"
  },
  "provenance": {
    "relative_pdf_path": "Full set of GRI Standards - English\\GRI Standards Glossary 2025.pdf",
    "file_size_bytes": 745639,
    "page_count": 26,
    "sha256": "04a52eea8a38a33be0137d5dbe7faf4f23e1285c29c4245c8856c37df1cf6da2",
    "indexed_at": "2026-07-25T14:35:59.476976"
  },
  "disclosures_count": 1,
  "disclosures": [
    {
      "disclosure_id": "2-25",
      "title_en": "in GRI 2: General Disclosures 2021 for more",
      "title_vi": "in GRI 2: General Disclosures 2021 for more",
      "disclosure_type": "Topic-Specific",
      "mandatory": true,
      "requirements": [
        {
          "requirement_id": "2-25:a",
          "item_code": "a",
          "description_en": "Report according to requirement of 2-25 (in GRI 2: General Disclosures 2021 for more)",
          "description_vi": null,
          "requirement_type": "Qualitative",
          "unit_of_measure": [],
          "breakdown_dimensions": []
        }
      ],
      "recommendations_en": null,
      "recommendations_vi": null,
      "sdg_mapping": [],
      "esrs_mapping": [],
      "issb_mapping": []
    }
  ]
}