{
  "node_tier": "T1 — Identity (Thực thể bền phi thời gian)",
  "standard_id": "GRI 418",
  "title_en": "Customer Privacy 2016",
  "title_vi": "Customer Privacy 2016",
  "pillar": "S — Social",
  "series": "Social (400 Series)",
  "category": "Topic-Social",
  "temporal_validity": {
    "version_id": "GRI_418_2016",
    "version_year": 2016,
    "effective_date": "2017-01-01",
    "valid_until_year": null,
    "status": "Active",
    "replaced_by_standard_id": null
  },
  "scope": {
    "target_audience": "Tổ chức thuộc nhóm Social (400 Series)",
    "sector_code": null,
    "materiality_required": true,
    "boundary_scope": "Toàn bộ tổ chức & Chuỗi giá trị"
  },
  "provenance": {
    "relative_pdf_path": "Full set of GRI Standards - English\\GRI 418_ Customer Privacy 2016.pdf",
    "file_size_bytes": 825988,
    "page_count": 12,
    "sha256": "7735430fcdcf04ba44c4bc110cb64c3d97afa642d15e1d17c859cf3783210be9",
    "indexed_at": "2026-07-25T14:35:59.428979"
  },
  "disclosures_count": 2,
  "disclosures": [
    {
      "disclosure_id": "418-1",
      "title_en": "Substantiated complaints concerning breaches of customer",
      "title_vi": "Substantiated complaints concerning breaches of customer",
      "disclosure_type": "Topic-Specific",
      "mandatory": true,
      "requirements": [
        {
          "requirement_id": "418-1:a",
          "item_code": "a",
          "description_en": "Report according to requirement of 418-1 (Substantiated complaints concerning breaches of customer)",
          "description_vi": null,
          "requirement_type": "Qualitative",
          "unit_of_measure": [],
          "breakdown_dimensions": []
        }
      ],
      "recommendations_en": null,
      "recommendations_vi": null,
      "sdg_mapping": [],
      "esrs_mapping": [],
      "issb_mapping": []
    },
    {
      "disclosure_id": "3-3",
      "title_en": "in GRI 3: Material Topics 2021 (see clause 1.1 in this Standard);",
      "title_vi": "in GRI 3: Material Topics 2021 (see clause 1.1 in this Standard);",
      "disclosure_type": "Topic-Specific",
      "mandatory": true,
      "requirements": [
        {
          "requirement_id": "3-3:a",
          "item_code": "a",
          "description_en": "Report according to requirement of 3-3 (in GRI 3: Material Topics 2021 (see clause 1.1 in this Standard);)",
          "description_vi": null,
          "requirement_type": "Qualitative",
          "unit_of_measure": [],
          "breakdown_dimensions": []
        }
      ],
      "recommendations_en": null,
      "recommendations_vi": null,
      "sdg_mapping": [],
      "esrs_mapping": [],
      "issb_mapping": []
    }
  ]
}