{
  "node_tier": "T1 — Identity (Thực thể bền phi thời gian)",
  "standard_id": "GRI 410",
  "title_en": "Security Practices 2016",
  "title_vi": "GRI 410: Thực hành an ninh 2016",
  "pillar": "S — Social",
  "series": "Social (400 Series)",
  "category": "Topic-Social",
  "temporal_validity": {
    "version_id": "GRI_410_2016",
    "version_year": 2016,
    "effective_date": "2017-01-01",
    "valid_until_year": null,
    "status": "Active",
    "replaced_by_standard_id": null
  },
  "scope": {
    "target_audience": "Tổ chức thuộc nhóm Social (400 Series)",
    "sector_code": null,
    "materiality_required": true,
    "boundary_scope": "Toàn bộ tổ chức & Chuỗi giá trị"
  },
  "provenance": {
    "relative_pdf_path": "Full set of GRI Standards - English\\GRI 410_ Security Practices 2016.pdf",
    "file_size_bytes": 841542,
    "page_count": 25,
    "sha256": "7128a7c0a4925e481ebc88801baa5cfdd6119b938241c69048987c4c03882508",
    "indexed_at": "2026-08-01T20:30:14.425963"
  },
  "disclosures_count": 1,
  "disclosures": [
    {
      "disclosure_id": "410-1",
      "title_en": "Security personnel trained in human rights policies or procedures",
      "title_vi": "Security personnel trained in human rights policies or procedures",
      "disclosure_type": "Topic-Specific",
      "mandatory": true,
      "requirements": [
        {
          "requirement_id": "410-1:1",
          "item_code": "1",
          "description_en": "Clause 1: International Code of Conduct for Private Security Service Providers, 2010.",
          "description_vi": "Tổ chức báo cáo thông tin chi tiết về: International Code of Conduct for Private Security Service Providers, 2010.",
          "requirement_type": "Qualitative",
          "unit_of_measure": [],
          "breakdown_dimensions": [
            "by facility",
            "by region",
            "by business line"
          ]
        }
      ],
      "recommendations_en": "Follow GRI technical compilation recommendations for Disclosure 410-1.",
      "recommendations_vi": "Tuân thủ các khuyến nghị kỹ thuật và phương pháp luận tổng hợp dữ liệu cho Chỉ số 410-1.",
      "sdg_mapping": [
        "SDG 12: Responsible Consumption and Production"
      ],
      "esrs_mapping": [
        "ESRS 2 General Disclosures"
      ],
      "issb_mapping": [
        "IFRS S1 General Requirements"
      ]
    }
  ]
}