{
  "node_tier": "T1 — Identity (Thực thể bền phi thời gian)",
  "standard_id": "GRI 306",
  "title_en": "Waste 2020",
  "title_vi": "Waste 2020",
  "pillar": "E — Environmental",
  "series": "Environmental (300 Series / Revisions)",
  "category": "Topic-Environmental",
  "temporal_validity": {
    "version_id": "GRI_306_2020",
    "version_year": 2020,
    "effective_date": "2021-01-01",
    "valid_until_year": null,
    "status": "Active",
    "replaced_by_standard_id": null
  },
  "scope": {
    "target_audience": "Tổ chức thuộc nhóm Environmental (300 Series / Revisions)",
    "sector_code": null,
    "materiality_required": true,
    "boundary_scope": "Toàn bộ tổ chức & Chuỗi giá trị"
  },
  "provenance": {
    "relative_pdf_path": "Full set of GRI Standards - English\\GRI 306_ Waste 2020.pdf",
    "file_size_bytes": 1722664,
    "page_count": 30,
    "sha256": "29912998398a42a5152a47aceaffbf8892a6aec4ad8e766ee9661299559a63de",
    "indexed_at": "2026-07-25T14:35:58.825158"
  },
  "disclosures_count": 7,
  "disclosures": [
    {
      "disclosure_id": "306-1",
      "title_en": "Waste generation and significant waste-related impacts",
      "title_vi": "Waste generation and significant waste-related impacts",
      "disclosure_type": "General Disclosures",
      "mandatory": true,
      "requirements": [
        {
          "requirement_id": "306-1:a",
          "item_code": "a",
          "description_en": "Report according to requirement of 306-1 (Waste generation and significant waste-related impacts)",
          "description_vi": null,
          "requirement_type": "Quantitative",
          "unit_of_measure": [],
          "breakdown_dimensions": []
        }
      ],
      "recommendations_en": null,
      "recommendations_vi": null,
      "sdg_mapping": [],
      "esrs_mapping": [],
      "issb_mapping": []
    },
    {
      "disclosure_id": "306-2",
      "title_en": "Management of significant waste-related impacts",
      "title_vi": "Management of significant waste-related impacts",
      "disclosure_type": "General Disclosures",
      "mandatory": true,
      "requirements": [
        {
          "requirement_id": "306-2:a",
          "item_code": "a",
          "description_en": "Report according to requirement of 306-2 (Management of significant waste-related impacts)",
          "description_vi": null,
          "requirement_type": "Quantitative",
          "unit_of_measure": [],
          "breakdown_dimensions": []
        }
      ],
      "recommendations_en": null,
      "recommendations_vi": null,
      "sdg_mapping": [],
      "esrs_mapping": [],
      "issb_mapping": []
    },
    {
      "disclosure_id": "306-3",
      "title_en": "Waste generated",
      "title_vi": "Waste generated",
      "disclosure_type": "General Disclosures",
      "mandatory": true,
      "requirements": [
        {
          "requirement_id": "306-3:a",
          "item_code": "a",
          "description_en": "Report according to requirement of 306-3 (Waste generated)",
          "description_vi": null,
          "requirement_type": "Quantitative",
          "unit_of_measure": [],
          "breakdown_dimensions": []
        }
      ],
      "recommendations_en": null,
      "recommendations_vi": null,
      "sdg_mapping": [],
      "esrs_mapping": [],
      "issb_mapping": []
    },
    {
      "disclosure_id": "306-4",
      "title_en": "Waste diverted from disposal",
      "title_vi": "Waste diverted from disposal",
      "disclosure_type": "General Disclosures",
      "mandatory": true,
      "requirements": [
        {
          "requirement_id": "306-4:a",
          "item_code": "a",
          "description_en": "Report according to requirement of 306-4 (Waste diverted from disposal)",
          "description_vi": null,
          "requirement_type": "Quantitative",
          "unit_of_measure": [],
          "breakdown_dimensions": []
        }
      ],
      "recommendations_en": null,
      "recommendations_vi": null,
      "sdg_mapping": [],
      "esrs_mapping": [],
      "issb_mapping": []
    },
    {
      "disclosure_id": "306-5",
      "title_en": "Waste directed to disposal",
      "title_vi": "Waste directed to disposal",
      "disclosure_type": "General Disclosures",
      "mandatory": true,
      "requirements": [
        {
          "requirement_id": "306-5:a",
          "item_code": "a",
          "description_en": "Report according to requirement of 306-5 (Waste directed to disposal)",
          "description_vi": null,
          "requirement_type": "Quantitative",
          "unit_of_measure": [],
          "breakdown_dimensions": []
        }
      ],
      "recommendations_en": null,
      "recommendations_vi": null,
      "sdg_mapping": [],
      "esrs_mapping": [],
      "issb_mapping": []
    },
    {
      "disclosure_id": "3-3",
      "title_en": "in GRI 3: Material Topics 2021 (see clause 1.1 in this Standard);",
      "title_vi": "in GRI 3: Material Topics 2021 (see clause 1.1 in this Standard);",
      "disclosure_type": "General Disclosures",
      "mandatory": true,
      "requirements": [
        {
          "requirement_id": "3-3:a",
          "item_code": "a",
          "description_en": "Report according to requirement of 3-3 (in GRI 3: Material Topics 2021 (see clause 1.1 in this Standard);)",
          "description_vi": null,
          "requirement_type": "Qualitative",
          "unit_of_measure": [],
          "breakdown_dimensions": []
        }
      ],
      "recommendations_en": null,
      "recommendations_vi": null,
      "sdg_mapping": [],
      "esrs_mapping": [],
      "issb_mapping": []
    },
    {
      "disclosure_id": "302-2",
      "title_en": "in GRI 302:",
      "title_vi": "in GRI 302:",
      "disclosure_type": "General Disclosures",
      "mandatory": true,
      "requirements": [
        {
          "requirement_id": "302-2:a",
          "item_code": "a",
          "description_en": "Report according to requirement of 302-2 (in GRI 302:)",
          "description_vi": null,
          "requirement_type": "Qualitative",
          "unit_of_measure": [],
          "breakdown_dimensions": []
        }
      ],
      "recommendations_en": null,
      "recommendations_vi": null,
      "sdg_mapping": [],
      "esrs_mapping": [],
      "issb_mapping": []
    }
  ]
}