{
  "node_tier": "T1 — Identity (Thực thể bền phi thời gian)",
  "standard_id": "GRI 407",
  "title_en": "Freedom of Association and Collective Bargaining 2016",
  "title_vi": "Freedom of Association and Collective Bargaining 2016",
  "pillar": "S — Social",
  "series": "Social (400 Series)",
  "category": "Topic-Social",
  "temporal_validity": {
    "version_id": "GRI_407_2016",
    "version_year": 2016,
    "effective_date": "2017-01-01",
    "valid_until_year": null,
    "status": "Active",
    "replaced_by_standard_id": null
  },
  "scope": {
    "target_audience": "Tổ chức thuộc nhóm Social (400 Series)",
    "sector_code": null,
    "materiality_required": true,
    "boundary_scope": "Toàn bộ tổ chức & Chuỗi giá trị"
  },
  "provenance": {
    "relative_pdf_path": "Full set of GRI Standards - English\\GRI 407_ Freedom of Association and Collective Bargaining 2016.pdf",
    "file_size_bytes": 871481,
    "page_count": 13,
    "sha256": "43eb7a252dfe418c12641e593a3a8356c9a1a01f1ce621ccee5ee9d6b193a698",
    "indexed_at": "2026-07-25T14:35:59.158369"
  },
  "disclosures_count": 3,
  "disclosures": [
    {
      "disclosure_id": "407-1",
      "title_en": "Operations and suppliers in which the right to freedom of",
      "title_vi": "Operations and suppliers in which the right to freedom of",
      "disclosure_type": "Topic-Specific",
      "mandatory": true,
      "requirements": [
        {
          "requirement_id": "407-1:a",
          "item_code": "a",
          "description_en": "Report according to requirement of 407-1 (Operations and suppliers in which the right to freedom of)",
          "description_vi": null,
          "requirement_type": "Qualitative",
          "unit_of_measure": [],
          "breakdown_dimensions": []
        }
      ],
      "recommendations_en": null,
      "recommendations_vi": null,
      "sdg_mapping": [],
      "esrs_mapping": [],
      "issb_mapping": []
    },
    {
      "disclosure_id": "2-30",
      "title_en": "in GRI 2: General Disclosures 2021 requires reporting on the percentage of",
      "title_vi": "in GRI 2: General Disclosures 2021 requires reporting on the percentage of",
      "disclosure_type": "Topic-Specific",
      "mandatory": true,
      "requirements": [
        {
          "requirement_id": "2-30:a",
          "item_code": "a",
          "description_en": "Report according to requirement of 2-30 (in GRI 2: General Disclosures 2021 requires reporting on the percentage of)",
          "description_vi": null,
          "requirement_type": "Qualitative",
          "unit_of_measure": [],
          "breakdown_dimensions": []
        }
      ],
      "recommendations_en": null,
      "recommendations_vi": null,
      "sdg_mapping": [],
      "esrs_mapping": [],
      "issb_mapping": []
    },
    {
      "disclosure_id": "3-3",
      "title_en": "in GRI 3: Material Topics 2021 (see clause 1.1 in this Standard);",
      "title_vi": "in GRI 3: Material Topics 2021 (see clause 1.1 in this Standard);",
      "disclosure_type": "Topic-Specific",
      "mandatory": true,
      "requirements": [
        {
          "requirement_id": "3-3:a",
          "item_code": "a",
          "description_en": "Report according to requirement of 3-3 (in GRI 3: Material Topics 2021 (see clause 1.1 in this Standard);)",
          "description_vi": null,
          "requirement_type": "Qualitative",
          "unit_of_measure": [],
          "breakdown_dimensions": []
        }
      ],
      "recommendations_en": null,
      "recommendations_vi": null,
      "sdg_mapping": [],
      "esrs_mapping": [],
      "issb_mapping": []
    }
  ]
}